{
  "schemaVersion": "solari-app-attest-research-envelope-v1",
  "challengeID": "30000000-0000-0000-0000-000000000002",
  "keyID": "AAAAAAAAAAAAAAAAAAAAAAAAAAAAAAAAAAAAAAAAAAA=",
  "assertionObject": "oA==",
  "payloadBase64": "ewogICJzY2hlbWFWZXJzaW9uIjogInNvbGFyaS1zaG9wcGluZy1yZXNlYXJjaC1yZXF1ZXN0LXYyIiwKICAicmVxdWVzdElEIjogInJlcXVlc3QtaWRlbnRpZmllciIsCiAgImRlbW9JRCI6ICJvd25lZC1kZW1vLWdyb2Nlci1iYXNrZXQtdjIiLAogICJzdWJtaXR0ZWRBdCI6ICIyMDI2LTA5LTAxVDE0OjAwOjAwWiIsCiAgInJldGFpbGVySUQiOiAic21hcnRjYXJ0LWRlbW8tZ3JvY2VyIiwKICAiZXhlY3V0aW9uTW9kZSI6ICJsaXZlIiwKICAic3RvcmVSZWZlcmVuY2UiOiAic21hcnRjYXJ0LWRlbW8tZ3JvY2VyLW93bmVkLWNhdGFsb2ctdjEiLAogICJyZXF1aXJlbWVudHMiOiBbCiAgICB7CiAgICAgICJpZCI6ICIyMDAwMDAwMC0wMDAwLTAwMDAtMDAwMC0wMDAwMDAwMDAwMDEiLAogICAgICAiaW5ncmVkaWVudElEIjogIjMwMDAwMDAwLTAwMDAtMDAwMC0wMDAwLTAwMDAwMDAwMDAwMSIsCiAgICAgICJuYW1lIjogIkNoaWNrZW4gYnJlYXN0IiwKICAgICAgInJlcXVlc3RlZFF1YW50aXR5VGV4dCI6ICIxLjUgbGIiLAogICAgICAicmVxdWlyZWRRdWFudGl0eSI6IDEuNSwKICAgICAgInVuaXQiOiAibGIiLAogICAgICAiY2FuZGlkYXRlUHJvZHVjdElEcyI6IFsiMTA0MTQ2ODAiXQogICAgfQogIF0KfQo="
}
